platform,category,title,description,skills,budget,time_left,bids_count,url,scraped_at
Freelancer.com,Web Development,Comprehensive Digital Brand Kit,"I’m refreshing my online presence and need a cohesive brand kit that works seamlessly on both social media and my website. For the social channels, I’ll rely on you to create adaptable templates for posts, stories, and ads so I can roll out campaigns quickly without breaking visual consistency. On the site side, I already have a logo I love; what’s missing is a refined color palette and complementary typography hierarchy that translate perfectly from desktop to mobile. Here’s what I’d like handed over: • Social templates: editable files for feed posts, vertical stories, and ad variations ready for Facebook, Instagram, and LinkedIn sizing. • Website guidelines: a primary and secondary color palette with HEX/RGB codes, plus heading, sub-heading, an...","['Adobe Illustrator', 'Adobe Photoshop', 'Branding', 'Figma', 'Graphic Design', 'HTML', 'Website Design', 'WordPress']",$387,6 days left,40.0,https://www.freelancer.com/projects/adobe-illustrator/comprehensive-digital-brand-kit-40063087,2025-12-14T14:03:58
Freelancer.com,Web Development,Rapid Web Development for Reseller Platform,"HIRING WEB DEVELOPER – DYNAMIC WEBSITE (FIXED PRICE | 2 DAYS DELIVERY) Budget: USD 100 (Fixed Price) Deadline: 2 Days Delivery I already have a full HTML/CSS demo for the website (reseller platform – I need a developer to convert it into a fully dynamic, working website. --- Your Tasks Convert single-file HTML demo into a modern dynamic website Create reseller registration system (database or Google Sheets) Build a tracking page (placeholder API or simple logic) Add reseller login system (basic authentication + dashboard placeholder) Make catalog & pages dynamic-ready (no backend content required yet) Ensure full responsiveness & clean UI/UX Deliver a clean, well-structured project, ready for Phase 2 expansion --- Requirements Strong HTML / CSS / JavaSc...","['API Development', 'Database Management', 'HTML', 'JavaScript', 'Node.js', 'PHP', 'Web Development', 'Website Design']",$26,6 days left,37.0,https://www.freelancer.com/projects/api-developmet/rapid-web-development-for-reseller,2025-12-14T14:03:58
Freelancer.com,Web Development,Classical E-Commerce Website Design Ahir fashion fort,"I’m launching an online store and need a fully-functioning e-commerce site that feels timeless rather than trendy. Think refined serif typography, a muted but elegant colour palette, balanced white space, and subtle ornamentation—classical in spirit yet completely up-to-date behind the scenes. Core features I must see live on day one: an intuitive shopping cart, a product-review section so customers can share feedback, and a secure payment-gateway integration that handles major cards without friction. Responsive behaviour across desktop, tablet, and mobile is non-negotiable; shoppers should enjoy the same polished experience whether they browse on a phone or a 27-inch monitor. Platform choice is open—Shopify, WooCommerce, custom PHP, or another stack—as long as it...","['CSS', 'eCommerce', 'HTML', 'Payment Gateway Integration', 'PHP', 'Shopify', 'Web Design', 'Web Development', 'Website Design', 'WooCommerce']",$254,6 days left,49.0,https://www.freelancer.com/projects/web-design/classical-commerce-website-design-ahir,2025-12-14T14:03:58
Freelancer.com,Web Development,Government Contractor Website Development,"I’m seeking a clean, modern website for Eagle Visual Solutions, LLC, designed to serve as a professional showcase for our visual design and graphic communication services supporting federal, state, and local government agencies, as well as prime contractors. The website should clearly highlight our core service areas—Graphic Design & Visual Communication and Branding & Visual Identity Services—with a layout that quickly guides visitors to these offerings and clearly communicates how we support agency communication, marketing, and mission-driven initiatives. Each service should have its own dedicated page featuring a concise service overview and a section reserved for client testimonials. I will provide all written content and testimonial quotes. The scope includ...","['CMS', 'Graphic Design', 'HTML', 'PHP', 'SEO', 'Web Design', 'Web Development', 'Website Design']",$534,6 days left,131.0,https://www.freelancer.com/projects/web-development/government-contractor-website,2025-12-14T14:03:58
Freelancer.com,Web Development,Earn 15% Finding Web Clients for website design agency,"I run a full-service digital studio that builds websites, mobile apps, and provides domain registration and hosting. I’m ready to scale and will pay you 15 % of every invoice you bring in, no caps or thresholds—your earnings rise with each paying client you close. The channels I want to push hardest are social media (Facebook, Instagram, LinkedIn), well-crafted email sequences (newsletters, promotions, and follow-ups), and steady, on-page/off-page SEO. You’re free to blend these tactics as long as the end result is a signed contract and cleared payment on my side. What I’ll supply: • A strong portfolio, case studies, and pricing sheets • Landing pages, tracking links, and discount codes if you need them • Fast responses for any technical questio...","['Digital Marketing', 'Email Marketing', 'Graphic Design', 'Internet Marketing', 'Lead Generation', 'SEO', 'Social Media Marketing', 'Website Design']",$19,6 days left,11.0,https://www.freelancer.com/projects/digital-marketing/earn-finding-web-clients-for,2025-12-14T14:03:58
Freelancer.com,Web Development,Build a Shopify Website,Build a Shopify Website For A Mens Tshirt Brand 'TheDheetClub',"['Adobe Illustrator', 'Branding', 'Corporate Identity', 'Graphic Design', 'Illustrator', 'Logo Design', 'Typography', 'Website Design']",$75,6 days left,33.0,https://www.freelancer.com/projects/branding/build-shopify-website,2025-12-14T14:03:58
Freelancer.com,Web Development,halo perkenalkan nama saya zayn umur saya 19 tahun saya berasal dari madura salam kenal ya kalo mau tau info lebih lanjut yuk ikutin aku,"I need clear, practical guidance on how to use Freelancer.com so I can confidently hire and manage talent for an upcoming web-based software development project. My goal is to learn the full workflow—from posting a brief that attracts the right developers, through evaluating bids, setting milestones, handling payments, and closing the project successfully. What I expect from you • A live screen-sharing session (or similar real-time walkthrough) where you demonstrate every key step inside the Freelancer platform • Tips tailored to my use case: “Mencari freelancer untuk proyek saya” in Pengembangan perangkat lunak, specifically Web projects • Advice on shortlisting, interview techniques, and milestone structuring to keep quality high and costs predictabl...","['Web Security', 'Website Design']",$20,6 days left,10.0,https://www.freelancer.com/projects/web-security/halo-perkenalkan-nama-saya-zayn,2025-12-14T14:03:58
Freelancer.com,Web Development,Restaurant Website Development,"I'm looking for a skilled web developer to create a comprehensive reservation and contact feature website for my restaurant. The site should include: - for a Good fine dining steakhouse with location specific details after guests picks a location - create menu items with details for each location - location specific events and specially pages - currently hosted at wix. - seo functionality - build a comprehensive website with admin panel or wix based. Ideal skills and experience: - Strong UI/UX design skills to ensure a smooth user experience - Familiarity with SEO best practices to enhance online visibility Please include samples of previous work, especially similar projects and pricing and timeline.","['Graphic Design', 'HTML', 'PHP', 'SEO', 'UI / User Interface', 'User Experience Research', 'UX / User Experience', 'Web Design', 'Web Development', 'Website Design']",$100,6 days left,173.0,https://www.freelancer.com/contest/restaurant-website-development-2670095,2025-12-14T14:03:58
Freelancer.com,Web Development,NGO Website Development,"I'm seeking a skilled web developer to create a comprehensive website for our NGO. The site should effectively communicate our mission, showcase our projects and impact stories, and provide information about our team. Key Features: - Insightful content on Mission and Vision, Projects and Impact Stories, Team Members and Contacts Ideal Skills and Experience: - Proven experience in building websites for NGOs or similar organizations - Strong content organization and presentation skills - Proficiency in SEO and user-friendly design - Ability to integrate multimedia elements (images, videos, etc.) to enhance storytelling","['Content Management System (CMS)', 'Graphic Design', 'HTML', 'PHP', 'SEO', 'Web Design', 'Web Development', 'Website Design']",$7,6 days left,26.0,https://www.freelancer.com/projects/web-development/ngo-website-development,2025-12-14T14:03:58
Freelancer.com,Web Development,Synapz Brand Premium WordPress Website Development -- 2,"Hi, I want to build a premium WordPress website for my brand Synapz – Learn | Earn | Evolve. Please check my complete requirements below: --- 1. Website Objective Youth-focused platform jisme Learning (Courses) Freelancer Projects (Earn) Productivity Tools ka complete ecosystem ho. --- 2. Pages Required Home Learn / Courses Freelance Projects Tools (Pomodoro, Notes, Goals, Resources) About Contact Login / Signup User Dashboard (Basic) --- 3. Design Expectations (Very Important) Tesla + Apple + Notion style UI Ultra clean, modern, white space heavy Youth-oriented + premium Rounded edges, smooth gradients Fully mobile responsive Fast loading (90+ Speed Score) --- 4. Technology Stack I Want WordPress (Latest Version) Theme: Astra Pro / Blocksy / Kaden...","['Elementor', 'Graphic Design', 'HTML', 'PHP', 'Security', 'SEO', 'Web Development', 'Website Design', 'Website Optimization', 'WordPress']",$75,6 days left,14.0,https://www.freelancer.com/projects/web-development/synapz-brand-premium-wordpress-website-40062917,2025-12-14T14:03:58
Freelancer.com,Web Development,Freelancer App Usage Guide web,"I need clear, practical guidance on how to use Freelancer.com so I can confidently hire and manage talent for an upcoming web-based software development project. My goal is to learn the full workflow—from posting a brief that attracts the right developers, through evaluating bids, setting milestones, handling payments, and closing the project successfully. What I expect from you • A live screen-sharing session (or similar real-time walkthrough) where you demonstrate every key step inside the Freelancer platform • Tips tailored to my use case: “Mencari freelancer untuk proyek saya” in Pengembangan perangkat lunak, specifically Web projects • Advice on shortlisting, interview techniques, and milestone structuring to keep quality high and costs predictabl...","['Web Security', 'Website Design']",$100000,6 days left,8.0,https://www.freelancer.com/projects/web-security/freelancer-app-usage-guide-web,2025-12-14T14:03:59
Freelancer.com,Web Development,Launch My 1-to-1 Training Business,"I’m ready to turn my expertise into a fully-fledged digital product: one-on-one training sessions delivered online. I already know the core offer—live, personalised coaching—but I need a specialist to help me translate that into a smooth, professional web presence and sales pipeline. Here’s what I’m looking for: • Clear guidance on the best platform stack to sell and schedule one-to-one sessions (think Stripe/PayPal for payments, Calendly or native booking for time slots, Zoom or similar for delivery). • A simple yet persuasive landing page that explains the value of my training, captures leads and routes clients directly to checkout. • Automation of confirmation e-mails, calendar invites and reminder sequences so every new student is onb...","['Automation', 'Digital Marketing', 'HTML', 'PayPal API', 'PHP', 'Sales', 'Web Development', 'Website Design']",$19,6 days left,26.0,https://www.freelancer.com/projects/web-development/launch-training-business,2025-12-14T14:03:59
Freelancer.com,Web Development,E-Commerce Website Development,"I’m ready to take my products online and need a developer who can plan, design, and build a full e-commerce website from the ground up. The finished site should look polished on desktop and mobile, load quickly, and give customers a smooth path from browsing to checkout. You’ll guide the technical stack—whether that means WooCommerce, Shopify, Magento, or a custom framework—so long as it can scale, is easy for me to manage day-to-day, and integrates reliably with a secure payment provider. I’m open to your recommendations on themes, plug-ins, and any third-party services that will improve performance, SEO, or conversion. When you apply, focus on your past experience delivering live e-commerce sites: • briefly describe a few recent projects (links ...","['eCommerce', 'Magento', 'PHP', 'Shopify', 'Web Development', 'Website Design', 'WooCommerce', 'WordPress']",$538,6 days left,48.0,https://www.freelancer.com/projects/web-development/commerce-website-development-40062865,2025-12-14T14:03:59
Freelancer.com,Web Development,Simple Donation Website with Testimonials,"I need a straightforward website that lets visitors support my cause through direct online donations. Crowdfunding platforms won’t be used—I prefer collecting contributions right on the site, routed through a secure payment gateway of your choice (Midtrans, PayPal, Stripe, or another reliable option you recommend). The core pages are modest: a clean landing page that explains the mission, a donation page where the payment form sits, and a dedicated area showcasing real donor testimonials to build trust. An intuitive dashboard for me to approve, edit, or remove those testimonials is essential so the stories stay authentic and relevant. Smooth mobile experience, SSL, and basic analytics integration round out the must-haves. Once the site is live, a quick walkthrough video or sh...","['CSS', 'Graphic Design', 'HTML', 'JavaScript', 'Payment Gateway Integration', 'PHP', 'Web Development', 'Website Design']",$402,6 days left,69.0,https://www.freelancer.com/projects/css/simple-donation-website-with,2025-12-14T14:03:59
Freelancer.com,Web Development,Corporate Website With Testimonials,"I want to launch a clean, professional company website that highlights who we are and what we do, with a dedicated section for client testimonials so visitors instantly see the proof of our results. Scope • Full web development from layout to deployment, focused on a corporate look and smooth navigation. • Build a testimonial module (slider, grid, or another elegant presentation you recommend) that I can easily update from an admin area. • The usual pages—home, services, about us, contact—are expected, but I do not need an e-commerce cart or a blog at this stage. Tech stack is flexible, though I lean toward widely supported options such as WordPress, Laravel, or similar PHP frameworks for ease of maintenance. If you prefer another stack, let me know w...","['CSS', 'HTML', 'Laravel', 'PHP', 'SEO', 'Web Development', 'Website Design']",$367,6 days left,86.0,https://www.freelancer.com/projects/css/corporate-website-with-testimonials,2025-12-14T14:03:59
Freelancer.com,Web Development,Timeless Sports Infrastructure Website,"I need a concise, high-impact website—just a single scrolling page or a tidy two-page structure—that immediately conveys our credibility in sports infrastructure development and management. The design direction is classic and timeless, using neutral, professional tones that complement high-resolution photography of stadiums, arenas, and training facilities we have delivered. Content to weave into the layout: • A clean company overview that sets out our core services and experience. • An elegant portfolio section with project images, key specs, and quick stats. • A short carousel or call-out area for authentic client testimonials. Please build the site so it feels premium yet fast: responsive across devices, optimised images, lightweight code, and clear ca...","['CSS', 'Graphic Design', 'HTML', 'Next.js', 'UI / User Interface', 'Web Design', 'Web Development', 'Website Design']",$206,6 days left,40.0,https://www.freelancer.com/projects/web-design/timeless-sports-infrastructure-website,2025-12-14T14:03:59
Freelancer.com,Web Development,Community-Building Digital Newsletter,"I'm looking for a creative and skilled newsletter designer to help engage and build a community around our brand. This digital newsletter will be sent out quarterly. The content will include: - Articles and blog posts - Event announcements - User-generated content Ideal skills and experience: - Experience in content curation and community engagement - Strong writing and editorial skills - Familiarity with newsletter design and distribution platforms - Ability to work on a quarterly schedule If you have a passion for building communities and can create engaging content, I'd love to hear from you!","['Content Creation', 'Content Writing', 'Copywriting', 'Digital Marketing', 'Editorial Design', 'Graphic Design', 'Website Design', 'Writing']",$84,6 days left,6.0,https://www.freelancer.com/projects/content-creation/community-building-digital-newsletter,2025-12-14T14:03:59
Freelancer.com,Web Development,Mobile-First E-Commerce Site Revamp -- 2,"At the outset, I want to take this opportunity to thank each and every Freelancer for responding to my project. Given the high number of responses (Bids: 380) and questions raised about this project, I have now attached an Update (File) titled: ""2026 HERM Logic AI+ Mobile First RFP"" - that will: (A) Provide clarity to the SoW (Scope of Work) (B) Provide a framework for you to Ask Questions, When to Submit your RFP Response/Quote, (C) Please review the RFP - SoW document in full. DO NOT CALL ME ... Post Your Questions through Freelance: 1. RFP Overview 2. Company Background 3. Project Objectives 4. Target Audiences 5. Scope of Work > 5.1 - 5.6 6. Technical Requirements 7. Deliverables 8. Budget Expectations (Your Price/Quote) 9. Delivery Timeline (Your Delivery Timeline...","['Bootstrap', 'CSS', 'Google Analytics', 'Graphic Design', 'HTML', 'JavaScript', 'SEO', 'Web Design', 'Web Development', 'Website Design']",$308,6 days left,81.0,https://www.freelancer.com/projects/javascript/mobile-first-commerce-site-revamp,2025-12-14T14:03:59
Freelancer.com,Web Development,Facebook Lead Form & Consultation,"I’m launching a new Facebook campaign and need a high-converting instant form that captures these details: Name, Phone, Budget, Authority, Need and Timeframe. The sole purpose is to collect contact information I can act on immediately through follow-up calls, private sales conversations and Messenger chats. I already have the ad creative and audience dialed in; what’s missing is your expertise inside Facebook Ads Manager (Meta Business Suite). I’d like you to build the form, attach it to the correct campaign objective, add the required privacy disclaimer and confirm that each lead reaches me without delay—whether that’s via a native CRM sync, Zapier or a simple CSV export. *Not AI: I would like to use Facebook's data storage. Once the form is live, spe...","['Digital Marketing', 'Facebook Ads', 'Facebook Marketing', 'HTML', 'Lead Generation', 'Mailchimp', 'PHP', 'Website Design']",$9,6 days left,23.0,https://www.freelancer.com/projects/facebook-ads/facebook-lead-form-consultation,2025-12-14T14:03:59
Freelancer.com,Web Development,WordPress E-commerce Plugin Fix,"My WooCommerce-driven store has suddenly stopped rendering products correctly. The catalogue either shows blank spaces or distorted layouts, while the rest of the site still loads fine. I’ve confirmed that the conflict is plugin-related and limited to the e-commerce plugin; SEO and security extensions behave normally. I’m not aware of any recent core, theme, or plugin changes that coincide with the break. Your task is to trace and eliminate the conflict, then restore normal product display without disrupting existing orders, customer data, or styling. That investigation may involve reviewing error logs, disabling/enabling plugins, checking theme overrides, and, if necessary, rolling back the offending update or rewriting the snippet that’s clashing with WooCommerce templ...","['CSS', 'PHP', 'Website Design', 'Website Optimization', 'Website Testing', 'WooCommerce', 'WordPress', 'WordPress Plugin']",$121,6 days left,97.0,https://www.freelancer.com/projects/wordpress-commerce-plugin-fix-fix,2025-12-14T14:03:59
Freelancer.com,Web Development,WordPress & SEO Co-Developer,"I’m midway through several PHP-driven projects that blend classic web apps with WordPress front-ends and I’d like a reliable partner to share the load. My focus is on the back-end—HTML, CSS (Bootstrap), JavaScript and MySQL—so I need you to take charge of everything that polishes the sites for users and search engines. Here’s what I’m counting on you for: • Crafting modern WordPress themes or child-themes that slot neatly into my PHP logic. • Shaping the user experience and visual identity—mock-ups, banners, icons, anything that helps the interface feel cohesive. • Running on-page SEO: smart keyword placement, clean URL structure, meta data, schema markup and performance tweaks so the sites can compete from day one. • Sup...","['Bootstrap', 'HTML', 'JavaScript', 'MySQL', 'PHP', 'SEO', 'Website Design', 'WordPress']",$121,6 days left,48.0,https://www.freelancer.com/projects/seo/wordpress-seo-developer-40062660,2025-12-14T14:03:59
Freelancer.com,Web Development,Cake PHP to iOS App Integration,"I need a skilled developer to transform my Cake PHP website into an iOS app. The app should include: - User login and authentication - Order processing and tracking The design should closely match the existing Cake PHP website. Experience with Cake PHP, iOS app development, and a strong portfolio in similar projects is ideal.","['API Development', 'App Development', 'CakePHP', 'iOS Development', 'iPhone', 'Mobile App Development', 'PHP', 'Website Design']",$213,6 days left,44.0,https://www.freelancer.com/projects/cakephp/cake-php-ios-app-integration,2025-12-14T14:04:00
Freelancer.com,Web Development,WooCommerce Website Dark Theme and Optimisation,"PROJECT TITLE WooCommerce (XStore Theme) – Permanent Dark Theme, Homepage & Shop Page Enhancements, Pre-Launch Optimisation --- PLATFORM & SETUP Platform: WordPress + WooCommerce Theme: XStore (must remain installed and active) Business: Online Tech Shop Project Status: Built, going live soon Remote: Yes --- PROJECT OVERVIEW I am preparing to launch an online tech shop built with WordPress + WooCommerce using the XStore theme. The site is already built but needs professional refinement, visual improvements, and polish before launch. I like the dark appearance currently seen on Samsung Internet, but this is caused by browser-level dark mode. This project requires a proper, site-controlled dark theme that is enabled by default across ALL browsers and devices. T...","['CSS', 'HTML', 'PHP', 'SEO', 'Web Design', 'Web Development', 'Website Design', 'Website Optimization', 'WooCommerce', 'WordPress']",$546,6 days left,126.0,https://www.freelancer.com/projects/woocommerce/woocommerce-website-dark-theme,2025-12-14T14:04:00
Freelancer.com,Web Development,E-Commerce Website Development,"I want to launch a fully-functional online store from the ground up. The core build must cover all typical e-commerce flows—product browsing, checkout and post-purchase engagement—while remaining clean, fast and easy for me to manage afterward. What I already know I need • Shopping cart that updates in real time • Secure payment gateway integration (credit card, e-wallets, and ideally PayPal) • Product review and rating section that I can moderate I’m open to the stack you prefer—Shopify, WooCommerce, custom Laravel, React + headless CMS, whatever you feel delivers a smooth UX and is scalable. Mobile-first design is important, and please keep SEO best practices in mind during the build. Deliverables 1. Responsive front-end with the three feat...","['eCommerce', 'HTML', 'Payment Gateway Integration', 'PHP', 'Shopify', 'Web Development', 'Website Design', 'WooCommerce']",$416,6 days left,68.0,https://www.freelancer.com/projects/web-development/commerce-website-development-40062622,2025-12-14T14:04:00
Freelancer.com,Web Development,TikTok Skincare Shop Setup,"I’m ready to launch a dedicated TikTok Shop that sells only skincare items from my beauty line, and I need a specialist who can take the store from zero to live, fully compliant, and conversion-ready. Here’s what I have in mind: • Create and configure the TikTok Shop account, including business verification, payment and shipping settings. • Build an eye-catching storefront that matches my existing brand identity for skincare. • Upload the initial catalogue (photos, short descriptions, pricing, stock) and organise items into clear collections so shoppers can browse cleansers, serums, moisturisers and more with ease. • Optimise listings for TikTok’s search and product recommendation engine. • Connect the shop to my TikTok profile, ensuring shoppabl...","['Digital Marketing', 'eBay', 'eCommerce', 'Product Descriptions', 'Shopify', 'Social Media Marketing', 'TikTok', 'Website Design']",$21,6 days left,20.0,https://www.freelancer.com/projects/tiktok/tiktok-skincare-shop-setup,2025-12-14T14:04:00
