platform,category,title,description,skills,budget,time_left,bids_count,url,scraped_at
Freelancer.com,Data Entry,Optimise Supplement Listings on Yasupps,"I have between 51 and 100 health-supplement SKUs waiting to go live on my DotPe store, and I need each one presented in a way that immediately outshines the competition. You’ll receive a spreadsheet with every product’s core details plus back-end access to the DotPe dashboard; from there, the goal is to turn each item into a polished, high-converting listing. High-resolution visuals matter most to me, so please source or retouch three to four images per product, making sure every shot is crisp, well-lit and consistent with DotPe’s recommended dimensions. Once the imagery is loaded, craft an SEO-friendly title and description that weave in the brand name, flavour, weight, price and any live discount without sounding spammy. I want visitors—and search engines—t...","['Content Writing', 'Copywriting', 'Data Entry', 'Digital Marketing', 'Excel', 'Graphic Design', 'Internet Marketing', 'Keyword Research', 'Product Photography', 'SEO']",$18,6 days left,8.0,https://www.freelancer.com/projects/content-writing/optimise-supplement-listings-yasupps,2025-12-14T14:04:36
Freelancer.com,Data Entry,Advanced Obsidian Productivity System with Data Integration & Dashboards -- 2,"Here is the finalized Project Description for you to post on Freelancer. I have updated it to reflect your preference for editing the Day-End data inside the Dashboard (with the external file as a fallback) and removed the specific DaVinci folder requirements. You can copy and paste the text below directly. *** ### Project Title: Advanced Obsidian Productivity System with Data Integration & Dashboards **Project Overview** I am looking for an Obsidian expert to build a unified Personal Productivity System based on a specific ""One Brain"" methodology. The system must integrate Daily Notes, Projects, and Areas into a seamless workflow. The core requirement is a custom integration between a Day-End Review system (stored in a structured table/file) and my Daily Notes, allowing...","['Automation', 'Data Entry', 'Data Visualization', 'Documentation', 'Excel', 'JavaScript']",$416,6 days left,60.0,https://www.freelancer.com/projects/documentation/advanced-obsidian-productivity-system-40062232,2025-12-14T14:04:36
Freelancer.com,Data Entry,Google Business Profile Information and SEO Update,"I need a detail-oriented freelancer who knows the Google Business Profile dashboard inside out to bring my listing up to 100 % completion. Right now the profile lacks key information and fresh visuals, which keeps it from ranking well and converting searchers into customers. Scope of work • Update the primary phone number and add our new dedicated support email so customers can reach us easily. • Select and apply the most accurate service categories that match what we actually offer. • Refresh the “from the business” section with a concise description and upload a small set of high-quality photos that showcase our premises and recent projects. • Double-check every field for consistency across Maps, Search and mobile, making sure nothing conflicts wi...","['Data Entry', 'Digital Marketing', 'Excel', 'Google Ads', 'Google Analytics', 'Research', 'SEO', 'Social Media Management', 'Web Search', 'Website Optimization']",$39,6 days left,19.0,https://www.freelancer.com/projects/seo/google-business-profile-information-seo,2025-12-14T14:04:36
Freelancer.com,Data Entry,"50,000 German SME and Large Companies CEO Contact List","I need a fresh, reliable list of Presidents, CEOs, or Managing Directors heading small- and medium-sized enterprises in Germany. The focus is strictly on SMEs rather than large corporations or non-profits, and data accuracy is far more important than sheer volume. Please source the information ethically—LinkedIn Sales Navigator, official company registers, Zoominfo, Apollo or comparable enrichment tools are all fine as long as the final file is clean and verifiable and recently updated. Deliver a spreadsheet (Excel Sheets) that, at minimum, includes: • Company name and website domain • Executive’s full name and exact title (President, CEO, or Managing Director only) Before you start, let me know how many records you expect to produce and the verification metho...","['Data Analysis', 'Data Collection', 'Data Entry', 'Data Management', 'Data Scraping', 'Excel', 'Google Sheets', 'Lead Generation', 'Research', 'Web Search']",$148,6 days left,43.0,https://www.freelancer.com/projects/data-collection/german-sme-large-companies-ceo,2025-12-14T14:04:36
Freelancer.com,Data Entry,Remote Application Form & Hiring Support,"The core of this remote role is twofold: first, accurately completing online application forms we receive each day, and second, keeping our hiring pipeline running smoothly with light-touch coordination. All work is handled through Google Workspace, so you’ll log progress in Sheets, draft messages in Docs, and manage calendar invites via Google Calendar. On a typical day I’ll assign a batch of candidate details; those must be transferred into our application forms without errors and submitted before the deadline. From there, you move straight to hiring support—confirming interview times, screening incoming résumés against a simple checklist I’ll provide, and making sure each successful applicant receives the right onboarding link and welcome packet. ...","['Data Entry', 'Workshops']",$2,6 days left,23.0,https://www.freelancer.com/projects/data-entry/remote-application-form-hiring-support,2025-12-14T14:04:36
Freelancer.com,Data Entry,Google Sheets Data Entry Cleanup,"I have a small batch of mixed data—numbers and text—that needs to be copied into a Google Sheet, slotted into the right columns, and kept tidy. The category structure is already laid out for you in a pre-defined template, so the main focus is careful transfer, clear labelling, and a quick pass with basic formulas. Most rows will only need SUM totals, but an occasional COUNT will help me keep track of record volume. Accuracy always outweighs speed here. If something looks unclear, a quick comment in the sheet is better than a silent guess. When you finish, the file should look clean, read logically from left to right, and require no extra reformatting on my end. Deliverable • A single Google Sheet populated, categorised, and checked for formula accuracy.","['Data Entry', 'Data Management', 'Data Processing', 'Excel', 'Google Sheets', 'Microsoft Office']",$3,6 days left,59.0,https://www.freelancer.com/projects/data-management/google-sheets-data-entry-cleanup,2025-12-14T14:04:36
Freelancer.com,Data Entry,Personal Expense Categorization & Budgeting,"Every day my digital-receipt app captures what I spend, and I export that feed straight into a Google Sheet. I need you to open that sheet once per day, tag every new line with the correct category—Food & Groceries, Transportation, Entertainment, or the catch-all “All Expenses”—and keep the file tidy and searchable. After the entries are classified, use the same spreadsheet to build a simple budgeting view: • weekly and monthly summaries, • a running “budget-vs-actual” for each category, • and a clear dashboard that highlights any overspend as soon as it happens. Everything stays inside the spreadsheet; no third-party accounting software is required. A short Loom video or written note explaining any formulas you add will be enough do...","['Accounting', 'Budgeting and Forecasting', 'Data Analysis', 'Data Entry', 'Data Management', 'Data Processing', 'Data Visualization', 'Excel', 'Google Sheets']",$2,6 days left,35.0,https://www.freelancer.com/projects/data-analysis/personal-expense-categorization,2025-12-14T14:04:36
Freelancer.com,Data Entry,Data Collection | Copy & Paste,"Position: Data Collection | Copy & Paste We are looking for freelancers to assist with 30,000 content entries using ChatGPT. This role does not require technical expertise and mainly involves copy–paste tasks and basic content publishing. Job Description: A data list will be provided in Excel format. Each entry consists of a title that will be used as input in ChatGPT. A ready-to-use ChatGPT prompt will be provided. Your task is simply to paste the prompt into ChatGPT, enter the given topic/title, and generate the content. The generated content will then be added to a WordPress website and submitted for publication review. Once these steps are completed, one content item is considered finished. The ChatGPT prompt is fully prepared. WordPress login details and a step-by-s...","['ChatGPT', 'Content Writing', 'Copy Typing', 'Copywriting', 'Data Collection', 'Data Entry', 'Excel', 'Freelance', 'Microsoft Word', 'WordPress']",$977,6 days left,263.0,https://www.freelancer.com/projects/chatgpt/data-collection-copy-paste,2025-12-14T14:04:36
Freelancer.com,Data Entry,Zotero-Based Reference Compilation for PhD Thesis,"I have a small project that needs to be done within the next few weeks. I need someone with knowledge of Zotero, and Harvard referencing style in particular. The aim is to input a complete list of my references in Zotero for my PhD thesis. Although this is already partially done, there are still a lot of websites, scholarly sources and books that I have not yet entered. I will provide several lists of citations on a Word document. You must cross-check these with the existing ones in Zotero, and highlight on the Word document the sources that have not yet been entered into Zotero, and highlight in a different colour the ones you suspect may be incorrectly written (e.g. date is wrong or author name is misspelled). If you find references that have already been entered into Zotero incorrectly,...","['Academic Research', 'Academic Writing', 'Data Entry', 'Editing', 'Proofreading', 'Research', 'Research Writing', 'Word Processing']",$111,6 days left,31.0,https://www.freelancer.com/projects/academic-research/zotero-based-reference-compilation-for,2025-12-14T14:04:43
Freelancer.com,Data Entry,Word Docs to Excel Workbook,"I need a series of existing Word documents converted into a single, well-structured Excel workbook that people can fill in quickly without breaking the layout. The source files mix text fields, numeric inputs, and date entries, so every sheet you build must handle those three data types cleanly with proper data validation where it helps. The workbook should be organised as multiple sheets, matching the logical sections of the Word docs. I also want a handful of simple formulas—think subtotals, averages, and automatic date-difference calculations—so users see key figures update the moment they enter data. Nothing advanced like macros is required, but clear cell protection, tab naming that mirrors the document headings, and professionally formatted tables are important for usabi...","['Data Analysis', 'Data Entry', 'Data Processing', 'Excel', 'Excel Macros', 'Excel VBA', 'Microsoft Office', 'Visual Basic']",$17,6 days left,150.0,https://www.freelancer.com/projects/microsoft-office/word-docs-excel-workbook,2025-12-14T14:04:43
Freelancer.com,Data Entry,Data Entry & Sales Report Assistant mı,"I’m looking for someone who can keep my daily workflow organised and my customers well-informed. All order and inventory figures will be entered straight into Google Sheets, so you must be comfortable working there, adding formulas when needed, and keeping every line item tidy and searchable. From those entries I’ll need a clear, easy-to-read laporan penjualan. I prefer a snapshot at the end of each day and a compiled weekly summary that highlights totals, best-selling items, and any unusual spikes or drops. Customer messages arrive through WhatsApp. Your job is to reply promptly in Bahasa Indonesia, using the tone and template I provide, then note any follow-ups inside the shared sheet. When a question involves basic medication use or interactions, you’ll give fact-che...","['Accounting', 'Customer Service', 'Data Entry', 'Data Management', 'Data Processing', 'Excel', 'Google Sheets', 'Inventory Management']",$5,6 days left,64.0,https://www.freelancer.com/projects/accounting/data-entry-sales-report-assistant,2025-12-14T14:04:43
Freelancer.com,Data Entry,Consolidate Product Data into Excel,"I have access to three separate online product databases and need every product brought together in a single Excel workbook that I’ll provide. The spreadsheet already contains the required column headers, so you’ll simply copy each product’s key details into the matching fields. All information lives in text or table form inside those databases, so no image downloads or formatting gymnastics are necessary. You’ll receive: • Direct links to the three sites • A locked-in Excel template with the exact columns and numerous example rows Acceptance is straightforward: • Every product from all three sources is included once and only once • Data appears exactly in the correct columns with no merged cells or stray formatting • File opens ...","['Data Collection', 'Data Entry', 'Data Integration', 'Data Processing', 'Excel']",$134,6 days left,155.0,https://www.freelancer.com/projects/data-collection/consolidate-product-data-into-excel,2025-12-14T14:04:43
Freelancer.com,Data Entry,Shopee Chat Support Needed,"I run a small Shopee store and can’t always stay online to handle incoming messages. The job is simple and well-suited to a beginner: keep an eye on the Shopee chat panel and answer product-related questions exactly as outlined in the FAQ and reply templates I will share. During the agreed hours you will: • Respond in Bahasa Indonesia within a few minutes of each new message. • Give accurate, polite answers about pricing, stock, variants, shipping options, and other common product queries. • Flag any unusual question you’re unsure about so I can step in. A short onboarding call and a reference sheet with all product details will be provided, so you don’t need prior e-commerce experience—just reliable internet, good spelling, and a friendly ton...","['Conflict Resolution', 'Customer Service', 'Data Entry', 'English (US) Translator', 'Indonesian Translator', 'Internet Research', 'Time Management', 'Translation']",$18,6 days left,62.0,https://www.freelancer.com/projects/customer-service/shopee-chat-support-needed,2025-12-14T14:04:43
Freelancer.com,Data Entry,Submissions of Websites Contact Form,"I have a list of 250 websites and I want to contact the owners through each site's contact form. I will provide: • A table (Google spreadsheet or Excel file, whichever you want) with each site’s URL • The exact text to paste in each field (my contact details, a short text message) I need you to: • Open each website and go to the contact form. • Copy/paste the information in the form's fields and send the form - only plain text. • Update the status for each entry in the spreadsheet meticulously (like: success, contact form unavailable, issue with submission, etc.) — these key words can also be copy/pasted too. Many websites do not have a contact form, in that case only updating the spreadsheet is enough. At the end, I need the updated spre...","['Copy Typing', 'Data Entry', 'Virtual Assistant']",$15,6 days left,101.0,https://www.freelancer.com/projects/data-entry/submissions-websites-contact-form,2025-12-14T14:04:43
Freelancer.com,Data Entry,One Million Indian Resumes PDF,"This project supports a large-scale skill-set evaluation study requiring a massive, well-structured dataset of Indian résumés. The goal is to collect 1,000,000 unique résumé files strictly in PDF format, focused only on Information Technology, Healthcare, and Education professionals who are Indian nationals or have primarily worked in India. No resume parsing or data extraction is required beyond light metadata for indexing. However, strict quality controls are essential: résumés must be readable, complete (education, work history, skills), non-duplicate, and free from corruption or password protection. The final delivery will include: A secure transfer of all PDF files A simple CSV/XLSX index mapping each file to basic metadata (industry tag, ...","['Data Analysis', 'Data Cleansing', 'Data Collection', 'Data Entry', 'Data Governance', 'Data Integration', 'Data Management', 'Data Processing']",$20,6 days left,13.0,https://www.freelancer.com/projects/data-collection/one-million-indian-resumes-pdf,2025-12-14T14:04:43
Freelancer.com,Data Entry,Indeed Recruiter with Employer Access,"I need help sourcing a steady pipeline of entry-level candidates directly through Indeed. You’ll log in with your own active Employer account (I don’t have one on my side) and use the resume database, job-post boosting, and any other tools you rely on to surface fresh, qualified profiles for the roles I share. Scope • Focus exclusively on sourcing; I’ll take care of interviews and onboarding once you hand over the shortlists. • Roles are all entry-level. The sector can vary from tech support to sales or general operations, so I’m counting on your filtering skills to match each brief as it comes in. Deliverables for each position 1. A spreadsheet of at least 15–20 pre-screened candidates who meet the stated requirements, including name, location, ...","['Data Entry', 'Data Processing', 'Excel', 'Human Resources', 'Sourcing', 'Talent Acquisition', 'Time Management', 'Web Search']",$3,6 days left,20.0,https://www.freelancer.com/projects/sourcing/indeed-recruiter-with-employer-access,2025-12-14T14:04:43
Freelancer.com,Data Entry,Accurate Numerical Data Entry,"I have a batch of figures that must be transferred into a master spreadsheet without a single error. The task is straightforward: open the source files I provide, enter each number into the correct cell of my Excel/Google Sheets template, preserve all number formats, and double-check totals as you go. An updated spreadsheet that matches my template row for row and passes my spot-checks for accuracy is the sole deliverable. I’ll share everything through a secure link the moment we start, and I’m ready to review your work as soon as you finish. If you’re quick on the keypad, meticulous with numbers, and can turn this around within 48 hours, let me know when you can begin.","['Data Analysis', 'Data Entry', 'Data Management', 'Data Processing', 'Excel', 'Google Sheets', 'Mathematics']",$9,6 days left,60.0,https://www.freelancer.com/projects/google-sheets/accurate-numerical-data-entry-40061548,2025-12-14T14:04:44
Freelancer.com,Data Entry,Pilates Event Outreach Assistant,"I’m seeking an experienced, proactive Virtual Assistant to support Form Fest, a premium Pilates event in Dubai. With 2 months until the event, this role requires someone who can work independently, move fast, and deliver with minimal oversight. Ideal for someone with strong research, database management, and outreach experience, preferably within the fitness, wellness, or Pilates space. Key Responsibilities Research and build a database of Pilates studios, instructors, communities, and wellness brands across Dubai & the UAE Collect and organise contact details (emails, social handles, websites) Identify Pilates communities, events, potential partners, sponsors, and media contacts Conduct outreach via email and social platforms to introduce Form Fest and encourage participati...","['Administrative Support', 'Data Entry', 'Database Management', 'Email Marketing', 'Fitness', 'Internet Research', 'Lead Generation', 'Project Management', 'Research', 'Virtual Assistant']",$135,6 days left,33.0,https://www.freelancer.com/projects/administrative-support/pilates-event-outreach-assistant,2025-12-14T14:04:44
Freelancer.com,Data Entry,Daily Sales Receipt Entry,"I run a small business that collects printed receipts every day. I’ve already created a shared Google Sheets file; what I need is a reliable hand to keep it up-to-date with the data on those receipts. Scope • Input every receipt from the current batch and any new ones I upload. • Record only the number of items sold on each receipt (no revenue figures or payment methods for now). • Maintain the existing column order, data validation, and simple SUM formulas that total the daily item count. • Flag any illegible or duplicate receipts in a separate “Issues” tab so I can check them quickly. Deliverable A neatly updated Google Sheets workbook that reflects 100 % of the receipts I provide, with all item-count totals matching the physical slips. ...","['Data Analysis', 'Data Collection', 'Data Entry', 'Data Management', 'Data Processing', 'Excel', 'Google Sheets', 'Visual Basic']",$8,5 days left,140.0,https://www.freelancer.com/projects/data-analysis/daily-sales-receipt-entry,2025-12-14T14:04:44
Freelancer.com,Data Entry,100k Finance CEO Contact List,"I’m putting together a database of 100,000 Presidents/CEOs, Owner or Founders. For every record, I need a valid and up to date Full name of each executive and their domain. To make sure we’re on the same page, here is what I expect to receive: • One CSV or Excel file containing exactly 100,000 unique rows • Columns: Full Name | Domain • All executives must hold a President/CEO, Owner and Founder title • Domains must resolve to active company websites and must not be free-mail providers • The database should be U.S only. If you already maintain or can rapidly build such a list, let me know your approach, typical turnaround time, and any data sources you rely on so I can gauge accuracy.","['Data Analysis', 'Data Collection', 'Data Entry', 'Data Mining', 'Data Processing', 'Data Scraping', 'Database Management', 'Excel', 'Web Scraping', 'Web Search']",$124,5 days left,42.0,https://www.freelancer.com/projects/data-collection/finance-ceo-contact-list,2025-12-14T14:04:44
Freelancer.com,Data Entry,تصمم و الاكسل,اي حاجه تخص الاكسل و تصمم تعلانات,"['Advertisement Design', 'Data Analysis', 'Data Entry', 'Data Management', 'Data Processing', 'Data Visualization', 'Excel', 'Excel Macros', 'Excel VBA', 'Graphic Design']",$379,5 days left,30.0,https://www.freelancer.com/projects/excel/project-40061267,2025-12-14T14:04:44
Freelancer.com,Data Entry,Reddit Outreach leads,"Hi, I’m looking for someone experienced in Reddit outreach who can help me find leads and message them manually (NO spam, NO bots). What you’ll do: Find relevant subreddits in my niche Identify potential clients/leads Do manual, personalized outreach (comments + DMs) Follow subreddit rules strictly Keep basic record of outreach done Requirements: Experience with Reddit outreach Knows how to avoid bans & spam Can personalize messages Honest & reliable Nice to have: Previous Reddit outreach results Lead generation experience","['Account Management', 'Content Writing', 'Data Entry', 'Excel', 'Internet Marketing', 'Lead Generation', 'Search Engine Marketing', 'Social Media Management', 'Social Networking', 'Virtual Assistant']",$75,5 days left,14.0,https://www.freelancer.com/projects/internet-marketing/reddit-outreach-leads,2025-12-14T14:04:44
Freelancer.com,Data Entry,Trucking Receipts & Invoice Assistant,"I run a small over-the-road trucking operation and need reliable remote help keeping paperwork and cash-flow in order. Each week drivers email or text photos of fuel, maintenance, toll, and lumper receipts. Your job is to collect these images, rename and file them in our shared drive, then key the details (date, vendor, amount, load #) into my Excel expense workbook. By Friday noon CT the workbook should generate a clear PDF expense report that you email back to me. On the revenue side, I’ll share completed rate confirmations. You’ll draft invoices in my Excel template, attach the supporting paperwork, and send them from my company mailbox. Afterward, monitor incoming mail for remittance notices, mark payments received, and flag anything that slips past due. While inside the ...","['Accounting', 'Administrative Support', 'Data Entry', 'Data Processing', 'Email Handling', 'Excel', 'PDF', 'Trucking']",$11,5 days left,51.0,https://www.freelancer.com/projects/accounting/trucking-receipts-invoice-assistant,2025-12-14T14:04:44
Freelancer.com,Data Entry,Rapid Vehicle Fitment Data Entry,"We have roughly 30,000 auto-parts SKUs sitting in the back-end of our Shopify store that still lack confirmed vehicle fitment. All that is missing is the correct Model and Make for each item. To finish this in the next seven days, I want a coordinated team (around ten people is ideal) that can open every product, jump to the relevant MFG’s website, verify the model/make compatibility, and enter the same data back into the Shopify fields. You will be working directly inside my store’s admin, so familiarity with Shopify bulk editing, CSV import/export, and variant metafields will help your speed. I can supply an initial spreadsheet containing product URLs and a column for the confirmed fitment; you can either work in that sheet or go straight into the product editor—whatev...","['Data Entry', 'Data Management', 'Data Processing', 'Excel', 'Inventory Management', 'Product Management', 'Shopify', 'Web Scraping']",$2141,5 days left,50.0,https://www.freelancer.com/projects/shopify-site/rapid-vehicle-fitment-data-entry,2025-12-14T14:04:44
