platform,category,title,description,skills,budget,time_left,bids_count,url,scraped_at
Freelancer.com,Python Development,AI Enhanced Wearable Reading Assistant Prototype,"Embedded Engineer - Wearable Smart Glasses + Pocket AI Unit (Prototype) Project Overview We are looking for an experienced embedded systems engineer (or a small team) to design and build a working prototype of a wearable visual reading assistant. The system is composed of: • 1. Smart Glasses (Head Unit): Image capture + bone conduction audio. • 2. Pocket Processing Unit: AI processing, 4G/Bluetooth communication, and power management. The system must be silent, reliable, and discreet, suitable for everyday use. This is a hardware + firmware project requiring industrial-quality execution. Scope of Work A. Head Unit (Smart Glasses) • Base Frame: Carrera 8825 or similar - Matte Black Acetate. Size: 55-16- 145. • Optical Prescription: The lenses must incorporate the prescri...","['Embedded Systems', 'PCB Design and Layout', 'Product Design', 'Python', 'Raspberry Pi', 'RESTful API', 'Soldering']",$521,6 days left,80.0,https://www.freelancer.com/projects/raspberry-pi/enhanced-wearable-reading-assistant,2025-12-14T14:03:19
Freelancer.com,Python Development,Paymob & WhatsApp Odoo Setup,"I need clear, actionable guidance to connect two services to my Odoo 18 instance without giving you direct server access. First, Paymob is already live and tied to our bank account; what’s missing is the technical bridge inside Odoo. I want each customer invoice to carry its own Paymob payment link and to trigger a confirmation notice inside Odoo the moment Paymob marks the bill settled. Second, Odoo 18 ships with the new WhatsApp connector, yet I still cannot send invoices or schedule quick auto-replies from within the Sales and Accounting apps. Your job is to walk me through activating those functions so my team can issue invoices through WhatsApp as easily as email and set basic automated responses. Because our database holds sensitive client data, you will guide me step-by-s...","['API Integration', 'ERP', 'Odoo', 'Payment Gateway Integration', 'Payment Processing', 'PostgreSQL', 'Python', 'Software Architecture']",$148,6 days left,22.0,https://www.freelancer.com/projects/odoo/paymob-whatsapp-odoo-setup,2025-12-14T14:03:19
Freelancer.com,Python Development,Desktop Installment Management Software,"I need a dedicated desktop application that lets me stay on top of every customer’s installment plan without juggling spreadsheets. The program must let me create flexible payment schedules, track each installment as it comes in, and automatically send reminder notifications when a due date is approaching or has slipped. A quick-view dashboard showing overdue, upcoming, and fully paid plans will help me act fast on any account that needs attention. Please build it as a standalone desktop solution—no web log-ins—so it runs smoothly on office PCs even when the internet is down. I’m open to the language or framework you prefer, provided the final installer is trouble-free and the interface is clean and intuitive. Deliverable acceptance will be straightforward: on...","['C# Programming', 'Database Management', 'Desktop Application', 'Java', 'Odoo', 'PHP', 'Python', 'Software Architecture', 'Software Development', 'User Interface / IA']",$11,6 days left,3.0,https://www.freelancer.com/projects/desktop-application/desktop-installment-management-software,2025-12-14T14:03:19
Freelancer.com,Python Development,Custom Software Task Automation,"I need to remove a repetitive chore from my day-to-day work inside a proprietary Windows application. Because the program is not Excel or File Explorer, there is no off-the-shelf macro tool I can lean on, so I’m looking for someone who can study the workflow, propose an elegant automation strategy, and deliver a working solution. Once we’re in chat I will walk you through the exact clicks, fields and screens involved; for now, think of it as a short sequence of actions that must be triggered reliably whenever a certain condition is met. I’m open to the technology you feel is best—Python (pywinauto, pynput), AutoHotkey, C# with UIAutomation, or a lightweight in-app plugin if the codebase allows. What matters most is stability, ease of deployment on multiple PCs, a...","['AutoHotkey', 'Automation', 'C Programming', 'C# Programming', 'C++ Programming', 'Python', 'Scripting', 'Software Architecture']",$198,6 days left,13.0,https://www.freelancer.com/projects/automation/custom-software-task-automation,2025-12-14T14:03:19
Freelancer.com,Python Development,Private project or contest #40063476,Please Sign Up or Login to see details.,"['Arduino', 'C++ Programming', 'Data Integration', 'Desktop Application', 'MQL5', 'Python', 'Software Architecture', 'Software Development']",,6 days left,,"https://www.freelancer.com/login?goto=M2YwMzMyODUwYzlhNGIyODc5ZTcxNjgzNDQ2M2QyYzFodHRwczovL3d3dy5mcmVlbGFuY2VyLmNvbS9wcm9qZWN0cy9tcWw1L2Jvb20tY3Jhc2gtc3Bpa2UtZGV0ZWN0b3I,",2025-12-14T14:03:19
Freelancer.com,Python Development,Auto Album Designing Desktop Software (AI-Based) – photoshop Windows,"PROJECT OVERVIEW I want to develop a Windows desktop software for automatic photo album designing, mainly for photography studios and album designers. The software should automatically create print-ready album layouts from selected photos, with smart photo arrangement, templates, and manual editing options. This will be a commercial product, not a college/demo project. MAIN OBJECTIVE Reduce manual album designing time Auto-arrange photos in professional layouts Provide manual editing control Export print-ready album files * CORE FEATURES (Must Have) * Photo Import Import photos from folder (bulk selection) Read EXIF data (date, orientation) Support JPG, PNG, TIFF * Auto Album Design One-click Auto Design Smart photo selection & placement Support different layouts: 1 pho...","['Graphic Design', 'Photo Editing', 'Photoshop', 'Python', 'Qt', 'Software Architecture', 'Software Development', 'Windows Desktop']",$1037,6 days left,12.0,https://www.freelancer.com/projects/python/auto-album-designing-desktop-software,2025-12-14T14:03:19
Freelancer.com,Python Development,Python Numerical Insights Analysis,"I have a set of numerical data that needs to be explored, cleaned, and mined for meaningful insights. The end goal is not a flashy dashboard or a predictive model, but a clear, well-documented story about what the numbers reveal. You’ll dive into the data with Python—think pandas for wrangling, NumPy for efficient computation, and matplotlib or seaborn for quick visual sanity checks. After cleaning and exploring, I expect a concise report or Jupyter Notebook that highlights key findings, trends, outliers, and any correlations worth noting. If you spot opportunities for simple statistical testing, include those results as well. Deliverables: • A reproducible Python script or notebook with all code, comments, and visualizations. • A brief summary (markdown or PD...","['Data Analysis', 'Data Visualization', 'NumPy', 'Pandas', 'Python', 'SPSS Statistics', 'Statistical Analysis', 'Statistics']",$57,6 days left,21.0,https://www.freelancer.com/projects/data-analysis/python-numerical-insights-analysis,2025-12-14T14:03:20
Freelancer.com,Python Development,Advanced Web Scraping Specialist,"I need a skilled web scraper to write a code which will retrieve data from a complex website. The data will be used for analysis. I have a webscraping requirement. i need the code ideally in google apps script, although i can accept python or nodejs. i use scrapingbee for proxy ip address. if you need to mask the ip address, you can use scrapingbee or equivalents. Requirement: 1. Given a string name i need to get the possible CIN 2. Given a CIN string i need to get the details as a json. MCA Home = And then … MCA Services > Master Data > Master Data v3 = Given a CIN / LLPIN (e.g. CIN = [U70100MH1978PTC020714, U70109TN2021PTC148489, U28121TN2008FTC068291, L74899DL1994PLC061295, L92490TN1994PLC027709], LLPIN = [AAC-4779,AAY-9624]), return the details as a json. Ideal Skill...","['BeautifulSoup', 'Google Apps Scripts', 'Python', 'Web Scraping']",$217,6 days left,15.0,https://www.freelancer.com/projects/beautifulsoup/advanced-web-scraping-specialist,2025-12-14T14:03:20
Freelancer.com,Python Development,Backend Developer for MVP Document Management System,"Backend Developer – Document Ingestion & Query System (MVP) We are looking for an experienced backend developer to help us build the first MVP of a document ingestion and querying system. The system processes documents (images, PDFs, text), extracts raw text via OCR, stores structured records in a SQL database, and allows querying those records through an API. This project is infrastructure-focused. The goal is to build a clean, extensible backend foundation. What the system does (high level) • Accepts uploaded documents (image / PDF) • Extracts raw text via OCR • Stores structured records (“cards”) in a database • Allows querying records by basic parameters (type, domain, status, entity) Detailed specifications will be shared during discussio...","['API Development', 'Backend Development', 'Documentation', 'FastAPI', 'Node.js', 'OCR', 'PostgreSQL', 'Python', 'RESTful API', 'SQL']",$665,6 days left,79.0,https://www.freelancer.com/projects/backend-development/backend-developer-for-mvp-document,2025-12-14T14:03:20
Freelancer.com,Python Development,TradingView EMA Line Indicator,"I’m building a lightweight TradingView study and need it coded in Pine Script v5. The core logic is straightforward: a single-length EMA (default 2, but freely adjustable in the settings panel) must plot continuously on the chart. The moment price pierces that EMA—whether up or down—I want the script to freeze the EMA value at that instant, project a horizontal line four candles backward and four candles forward, and leave that line locked in place until the next cross occurs. Only one such line should ever be visible; when a fresh cross happens, the previous line disappears and a new one is drawn at the latest locked level. Because I trade in real time, the alert for both “cross above” and “cross below” must trigger on the running candle, not onl...","['Metatrader', 'Pine Script', 'Python', 'Trading']",$388,6 days left,29.0,https://www.freelancer.com/projects/pine-script/tradingview-ema-line-indicator,2025-12-14T14:03:20
Freelancer.com,Python Development,"Python, SQL, & DSA Tutor Needed","Title: Looking for Python, SQL & DSA Tutor – From Basics to Advanced (LeetCode Focus) Job Description: I am looking for an experienced Python, SQL, and Data Structures & Algorithms (DSA) mentor who can train me from basic to advanced level with a strong focus on logic building and problem-solving. The main goal of this training is to help me confidently solve LeetCode problems (easy to medium and gradually hard) and prepare for coding rounds and technical interviews using Python. Key Requirements: Strong knowledge of Python programming Ability to teach Data Structures & Algorithms (DSA) in Python Good understanding of SQL (basic to advanced) Experience with LeetCode-style problems and coding interviews Ability to explain concepts from scratch and build problem-so...","['Big Data Sales', 'Coding', 'Data Analysis', 'Hadoop', 'Python', 'Software Development', 'SQL', 'Teaching/Lecturing', 'Training']",$74,6 days left,9.0,https://www.freelancer.com/projects/coding/python-sql-dsa-tutor-needed,2025-12-14T14:03:20
Freelancer.com,Python Development,Text to speech api not working in deployment need help,Need to check issue in webpage which has feature of text to speech conversion api feature.,"['Generative AI', 'Python']",$11,6 days left,15.0,https://www.freelancer.com/projects/generative-ai/text-speech-api-not-working,2025-12-14T14:03:20
Freelancer.com,Python Development,Need a python expert to help validate an opensource project feature,"Looking for an expert Python developer who has experience with Graph Databases to help validate GraphRag on Neo4j. Please get in touch if you have worked with the stack before, details to be sent in chat. Expect this might be a 10-15 mins validation if you know what you are doing. Start your bid with 'neo'","['Neo4j', 'Python']",$17,6 days left,27.0,https://www.freelancer.com/projects/neo4j/need-python-expert-help-validate,2025-12-14T14:03:20
Freelancer.com,Python Development,Full-Time Odoo Module Developer,"The task is to take full ownership of our Odoo stack on an ongoing, full-time basis. Everyday work revolves around designing, building and refining modules with Python, XML and PostgreSQL while keeping performance, security and Odoo best practices front and centre. Beyond writing code, the scope includes crafting new business workflows across HR, Accounting, Sales, Inventory apps etc, wiring Odoo to external services through REST and RPC APIs, and troubleshooting production issues until they are fully resolved. Deployments, version upgrades and data migrations are part of the routine, so clean scripts and an eye for backward compatibility are essential. Close collaboration with our functional team is expected: they translate business needs, you translate those into maintainable, well-tes...","['API Development', 'ERP', 'MySQL', 'Odoo', 'PostgreSQL', 'Python', 'Software Architecture', 'Software Development', 'Software Engineering', 'XML']",$10,6 days left,31.0,https://www.freelancer.com/projects/odoo/full-time-odoo-module-developer,2025-12-14T14:03:20
Freelancer.com,Python Development,Telegram Auto Join-Request Bot,"I want a small Telegram bot that automatically accepts every pending and future join request in my group and channels, then follows up with a single, standard welcome message. Nothing more—no member logging or database work is required. Here’s what I expect from you: • A clean, well-commented script (Python, Node.js or another reliable language you prefer) that can run 24/7 through a simple VPS or a cloud function. • Clear instructions on how I install the dependencies, create the BotFather token, add the bot as an admin and launch it. • A quick way to edit the text of the standard welcome message in case I want to change it later. As soon as the bot is tested live in my group and it automatically approves requests and posts the welcome text, the job is d...","['Automation', 'Bot Development', 'Cloud Computing', 'JavaScript', 'Node.js', 'PHP', 'Python', 'Telegram API']",$125,6 days left,21.0,https://www.freelancer.com/projects/bot-development/telegram-auto-join-request-bot,2025-12-14T14:03:20
Freelancer.com,Python Development,AI Job Portal & CV Builder,"I want to launch a web platform that feels as intuitive as LinkedIn, Bayt, or Indeed, yet is entirely driven by modern AI. The site must: • Instantly match candidates to openings with AI-powered job matching • Rewrite and format résumés (ATS CV compliance) through an AI-driven resume optimizer • Trigger automated job alerts the moment a suitable post appears Three audiences will use the system—job seekers, employers, and recruiters—so each needs a dedicated dashboard, analytics, and messaging. A recruiter should be able to post a vacancy, see AI-generated shortlists, and contact talent in a single flow; a job seeker should upload or paste a résumé, watch the optimizer improve it, then receive personalized roles seconds later. ...","['AI Chatbot Development', 'AI Development', 'AI Model Development', 'Django', 'Graphic Design', 'PHP', 'Python', 'Web Development']",$209,6 days left,55.0,https://www.freelancer.com/projects/ai-chatbot-development/job-portal-builder,2025-12-14T14:03:21
Freelancer.com,Python Development,Azure AI Expert,"What I Want to Learn I want structured training and practical guidance on the following Azure AI areas: Azure AI Services (Cognitive Services) Azure OpenAI Service Azure AI Studio Language Services (Text Analytics, Q&A, Conversational AI) Vision Services (OCR, Image Analysis) Azure Machine Learning Model training, deployment, and monitoring Using Azure ML Studio and SDK Generative AI & LLMs on Azure Prompt engineering RAG (Retrieval-Augmented Generation) Building AI chatbots using Azure OpenAI AI Solution Architecture Designing secure, scalable AI solutions Role-based access control (RBAC) Authentication and authorization Integration & Deployment Integrating Azure AI with web apps / APIs Best practices for production deployment Cost optimization and perform...","['AI Development', 'AI Model Development', 'AI Model Integration', 'Amazon Web Services', 'Azure', 'Classification', 'Data Analysis', 'NoSQL Couch & Mongo', 'Python', 'Software Architecture']",$11,6 days left,6.0,https://www.freelancer.com/projects/azure/azure-expert-40062812,2025-12-14T14:03:21
Freelancer.com,Python Development,Custom Private Server Development and Reverse Engineering,"I am looking to hire a highly skilled reverse engineer and game server developer who can help me create a custom private server. This game uses the Unreal Engine 3 (UE3). The official servers for the game have long since shut down, but there is an existing private server that the community has been working on and reverse-engineering. However, I'm interested in building my own version from scratch, with a fresh approach to the server-side infrastructure and game launcher. What I Have: Game Files: I have access to all the local client-side files (graphics, textures, sounds, models, etc.). However, I do not have access to the original source code, server-side files, or databases, as they are not publicly available. Private Server Access: There is a private server currently running, wh...","['C++ Programming', 'Database Design', 'Documentation', 'Game Development', 'Python', 'Reverse Engineering', 'Security', 'Unreal Engine']",$4098,6 days left,31.0,https://www.freelancer.com/projects/reverse-engineering/custom-private-server-development,2025-12-14T14:03:21
Freelancer.com,Python Development,Custom Smart Network Monitoring- Engineering Smart Network Monitor similar to zabbix from scratch,"I want to build a fully-featured network-monitoring platform from the ground up—something with the depth of Zabbix yet tailored to my exact environment and growth plans. What needs watching The system has to handle real-time traffic analysis, continuous device-health checks and active security-threat detection. I also need the freedom to add new metrics as the network evolves. Devices in scope Today I run a mixed estate of servers, routers/switches and a growing fleet of IoT devices, and that list will only expand. SNMP, agent-based collection and modern APIs should all be available so I’m never locked out of a data source. Alerts and visibility When anything crosses a threshold I expect immediate email and SMS notifications, plus clear dashboard pop-ups. Webhooks or ...","['Data Visualization', 'Docker', 'Internet Security', 'Kubernetes', 'Linux', 'Network Administration', 'Network Monitoring', 'PHP', 'Powershell', 'Python']",$36,6 days left,26.0,https://www.freelancer.com/projects/network-monitoring/custom-smart-network-monitoring,2025-12-14T14:03:21
Freelancer.com,Python Development,Python Text Processing Bug Fix,"My Python data-processing script parses large batches of text and suddenly started throwing wrong results and occasional tracebacks. The trouble sits squarely in the text parsing section—no web-scraping or API layers are involved—so the focus is on hunting down logical errors in the existing codebase, tightening the parsing logic, and making sure edge cases stop slipping through. You’ll receive the current .py files, sample input files, and the expected output format. I need you to isolate the bugs, patch them, and return a clean, well-commented script together with a short note explaining what changed and why. Quick turnaround is appreciated; once the fix passes my test set, the job is done.","['Data Analysis', 'Data Processing', 'Debugging', 'JavaScript', 'Python', 'Software Architecture', 'Software Development', 'Web Scraping']",$207,6 days left,38.0,https://www.freelancer.com/projects/debugging/python-text-processing-bug-fix,2025-12-14T14:03:21
Freelancer.com,Python Development,Fix Slow Photo Booth Capture,"I just need to get the frame border overlay showing properly as its very transparent on the preview screen, it shows good on the photo end product though. Also just adjusting the flow of the touch to start, countdown etc. It is working fine but just needt the tweaks. My photo booth is running a small Python app on Linux that composites a PNG overlay onto each captured image. Everything worked until recently, but now the overlay’s colours and alpha layer look wrong—whites appear grey, semi-transparent areas show up as solid blocks, and the final photo just doesn’t match the intended design. Deliverable: a working script or concise diff that restores correct colour and transparency rendering, plus a brief note on what went wrong so I can avoid it next time. I can provid...","['Linux', 'PHP', 'Python', 'Software Architecture']",$21,6 days left,12.0,https://www.freelancer.com/projects/linux/fix-slow-photo-booth-capture,2025-12-14T14:03:21
Freelancer.com,Python Development,Time-Series Analysis in Python Notebook,"I need a well-structured Jupyter notebook that walks from raw, time-stamped data all the way through cleaning, descriptive exploration, and clear visualisations. The dataset will arrive as a CSV and contains several months of sequential observations; I want to understand overall trends, seasonality, and any anomalies that stand out. Please rely on mainstream Python tooling—pandas for wrangling, NumPy where helpful, and visual libraries such as Matplotlib, Seaborn, or Plotly for compelling charts. The notebook should be fully commented so that another analyst can rerun or adapt the workflow on new data without guessing at intermediate steps. Deliverables: • Cleaned, ready-for-analysis data file • Jupyter notebook with step-by-step descriptive analysis and visuals &bull...","['Data Analysis', 'Data Visualization', 'Machine Learning (ML)', 'NumPy', 'Pandas', 'Python', 'Software Architecture', 'Statistics']",$7,6 days left,27.0,https://www.freelancer.com/projects/data-analysis/time-series-analysis-python-notebook,2025-12-14T14:03:21
Freelancer.com,Python Development,Full-Stack Developer for AI/ML Startup,"About the Role We're a bootstrapped AI/ML startup (Toronto-based, two-person founding team) looking for a Full-Stack Agent Engineer + DevOps Engineer to take our OpenAI-powered agents and Streamlit dashboards from local development into production-ready cloud infrastructure. You'll own the entire software lifecycle—from writing agent logic and APIs to designing and deploying our AWS architecture. This is a 0-to-1 role: you'll architect our first cloud deployment, establish CI/CD practices, define our codebase standards, and prepare the foundation for future team growth. You'll report directly to the founders and have significant autonomy in technical decision-making. What You'll Build Agent & Backend Development (60%) Build scalable Python services tha...","['Agentic AI', 'AI Development', 'Amazon Web Services', 'DevOps', 'Java', 'OpenAI', 'Python', 'Software Architecture', 'Streamlit']",$84,6 days left,12.0,https://www.freelancer.com/projects/ai-development/full-stack-developer-for-startup,2025-12-14T14:03:21
Freelancer.com,Python Development,"OpenSearch Ingest Pipeline, Queries, and Indices Setup","I am ready to stand up a production-grade OpenSearch environment and want your help wiring the full ingest pipeline. The core stack will be OpenSearch with FluentD as the log-management and routing layer, together with Data Prepper (or an equally effective OpenSearch component) for enrichment and trace analytics. Source variety is high: classic log files from several services, change-data-capture streams coming off our databases, and a real-time event feed. Most of what flows in is semi-structured—think JSON snippets with the occasional free-form field—so careful parsing, field mapping, and transformation will be essential before anything lands in an index. What I need from you • A reproducible configuration (YAML / Docker-Compose or Helm is fine) that spins up OpenSea...","['Data Processing', 'Elasticsearch', 'Hadoop', 'JSON', 'Performance Tuning', 'Python', 'Software Architecture']",$22,6 days left,58.0,https://www.freelancer.com/projects/json/opensearch-ingest-pipeline-queries,2025-12-14T14:03:21
Freelancer.com,Python Development,Improving Deep Learning Accuracy in Jupyter,"I’m working inside a Jupyter Notebook that contains several deep learning models for IMU fusion and activity recognition. The current accuracy is around 60%, but my target is at least 95%. i need to run the notebook on a high-performance GPU environment (such as an NVIDIA A100, V100, or T4) because the dataset is quite large and each model requires about 50 epochs of training, which takes several hours on CPU. task is to: Review the full deep learning pipeline (data preprocessing, normalization, window segmentation, and fusion setup). Tune the architectures if needed. Optimize training parameters (batch size, learning rate, dropout, and scheduler). Ensure class balance and correct label mapping Add early stopping and performance tracking per epoch. Provide comparisons showin...","['Data Science', 'Deep Learning', 'Java', 'Keras', 'Machine Learning (ML)', 'Model Tuning', 'Neural Networks', 'Python']",$134,6 days left,70.0,https://www.freelancer.com/projects/deep-learning/improving-deep-learning-accuracy-jupyter,2025-12-14T14:03:21
