platform,category,title,description,skills,budget,time_left,bids_count,url,scraped_at
Freelancer.com,Graphic Design,Lead-Gen Social Media Content,"I’m ready to ramp up both my Facebook and Instagram presence with content that actively pulls in new leads. What I need from you is a full-service approach: plan, create, and publish scroll-stopping visuals that speak directly to my audience and push them toward our sign-up funnel. Here’s how I see the collaboration working: • Strategy & Calendar Map out a 30-day content calendar that balances Reels, carousel images, and story snippets, all tied to clear calls-to-action leading to our lead-capture page. • Creative Production Design thumb-stopping image posts and short-form videos (15–60 sec). Strong motion graphics, on-brand colour palettes, crisp text overlays, and sound design that feels native to the platforms are key. Tools like Adobe Premiere...","['Adobe Photoshop', 'Adobe Premiere Pro', 'After Effects', 'Animation', 'Content Creation', 'Graphic Design', 'Social Media Marketing', 'Video Services']",$81,6 days left,9.0,https://www.freelancer.com/projects/social-media-marketing/lead-gen-social-media-content,2025-12-14T14:05:12
Freelancer.com,Graphic Design,Custom Travel Poster Designs,"I’m putting together a new collection of eye-catching travel posters and would like a designer or illustrator who can take the concept from rough idea to press-ready artwork. Here’s what I have in mind: once we start, I’ll send you a short list of destinations along with reference images and the mood I’m after. I’m flexible on style—vintage, modern, minimalist, or a creative mix—so long as each piece feels cohesive as a set and celebrates the personality of the place. You’ll sketch a few concepts for each location, incorporate my feedback, and then move on to polished finals. The finished posters should be supplied at 300 DPI for print (CMYK, A2 size) and as web-optimised RGB versions. Editable source files (AI/PSD or equivalent) and th...","['Adobe Illustrator', 'Adobe Photoshop', 'Art Consulting', 'Creative Design', 'Graphic Design', 'Illustrator', 'Photoshop', 'Photoshop Design']",$2,6 days left,15.0,https://www.freelancer.com/projects/adobe-illustrator/custom-travel-poster-designs,2025-12-14T14:05:12
Freelancer.com,Graphic Design,Professional Intro/Outro Animation Design to present our brand for youtube channel,"I’m ready to refresh my YouTube presence with a polished, professional-looking intro and outro. The goal is a cohesive template I can drop into every upload so the channel instantly feels corporate, trustworthy, and on-brand. Here’s what I’m after: • A short intro animation (5–8 seconds) that brings my logo on-screen with clean text effects and a custom background that matches my brand colours. • A matching outro (8–10 seconds) that reprises the logo, leaves space for end-screen elements, and closes with the same visual language. • Delivery in both 4K and 1080p, alpha-friendly formats (MOV/PNG sequence) plus an easily editable project file (After Effects, Premiere, or similar). The animation should feel sleek rather than flashy—think...","['2D Animation', '3D Animation', 'Adobe Creative Cloud', 'Adobe Premiere Pro', 'After Effects', 'Animation', 'Graphic Design', 'Logo Design', 'Video Editing', 'Video Services']",$14,6 days left,8.0,https://www.freelancer.com/projects/2d-animation/professional-intro-outro-animation,2025-12-14T14:05:12
Freelancer.com,Graphic Design,Private project or contest #2670167,Please Sign Up or Login to see details.,"['Branding', 'Business Card Design', 'Corporate Identity', 'Digital Design', 'Graphic Design', 'Logo Design', 'Photoshop', 'Typography', 'Visual Design', 'Web Design']",,6 days left,,https://www.freelancer.com/login?goto=YmY3ZWZjNzI4YjVlOGQ5NDg1ZmZhNWEwN2NmY2ZiMGFodHRwczovL3d3dy5mcmVlbGFuY2VyLmNvbS9jb250ZXN0Ly0yNjcwMTY3,2025-12-14T14:05:17
Freelancer.com,Graphic Design,Formal Uniform Design,"I need a skilled designer to create a formal uniform for my business. Requirements: - Design for all necessary uniform items (e.g., shirts, pants, jackets) - Professional and polished design suitable for a corporate setting - Ability to create cohesive and brand-aligned looks Ideal Skills: - Experience in corporate uniform design - Strong sense of professional fashion trends - Portfolio showcasing similar projects Please provide a portfolio with your bids.","['Branding', 'Creative Design', 'Fashion Consulting', 'Fashion Design', 'Graphic Design', 'Logo Design', 'Photoshop', 'Textile Design']",$191,6 days left,19.0,https://www.freelancer.com/projects/creative-design/formal-uniform-design,2025-12-14T14:05:19
Freelancer.com,Graphic Design,Residential Aesthetic Lighting Design,I'm looking for a lighting design consultant to enhance the aesthetics of my residential space. Key Requirements: - Experience in residential lighting design - Focus on aesthetic enhancement - Creative and innovative design solutions - Knowledge of current lighting trends and technologies Ideal Skills and Experience: - Interior design background - Strong portfolio in residential projects - Ability to work within budget constraints - Excellent communication and collaboration skills Please provide a portfolio with your bids.,"['3D Modelling', '3D Rendering', 'Architecture', 'Creative Design', 'Graphic Design', 'Home Design', 'Interior Design', 'Lighting Design']",$237,6 days left,9.0,https://www.freelancer.com/projects/lighting-design/residential-aesthetic-lighting-design,2025-12-14T14:05:19
Freelancer.com,Graphic Design,Family Portrait Editing,"I need multiple family portrait images edited from raw files. Requirements: - Head and smile swaps as needed - Background enhancements: blur and improve existing background Ideal Skills and Experience: - Proficient in photo editing software (e.g., Photoshop) - Experience with complex edits like head/smile swaps - Strong eye for improving photo backgrounds","['Background Removal', 'Graphic Design', 'Image Analysis', 'Image Processing', 'Photo Editing', 'Photo Retouching', 'Photoshop', 'Photoshop Design']",$59,6 days left,58.0,https://www.freelancer.com/projects/image-processing/family-portrait-editing,2025-12-14T14:05:19
Freelancer.com,Graphic Design,Premium Logo Design for Exam-prep SaaS,"Contest Title Premium, Calm Logo for | Exam-prep SaaS for California insurance licensing Brand / Project Overview is a subscription SaaS that helps California insurance candidates pass their licensing exams (primarily Property & Casualty, also Life/Health). The product provides a structured daily study plan, targeted practice, and clear progress tracking. We want a brand that feels premium and calm: confident, steady, and reassuring. More “quiet competence” than “hype.” What we need A primary logo plus variants that work across: • Website header (horizontal) • App icon / favicon (icon-only) • Social profile avatar (icon-only) • Light and dark backgrounds Brand personality • Calm confidence, clarity, trust • Modern, po...","['Adobe Illustrator', 'Branding', 'Graphic Design', 'Icon Design', 'Logo Design', 'Photoshop', 'Typography', 'Visual Design']",$369,6 days left,30.0,https://www.freelancer.com/projects/adobe-illustrator/premium-logo-design-for-exam,2025-12-14T14:05:20
Freelancer.com,Graphic Design,Christmas and new year poster - 12/12/2025 22:38 EST,"I’m looking to have a wedding invitation card designed in a clean, modern aesthetic that still feels soft and romantic thanks to pastel tones for the palette. There’s no strict deadline, so you can take the time needed to refine typography, layout, and any illustrative touches until the design feels just right. Final deliverables I expect: • A print-ready PDF sized for both standard A5 and US 5x7 formats • An editable source file (Adobe Illustrator, InDesign, or layered PSD) so I can tweak wording later • A web-optimised PNG/JPG for sharing online If you enjoy working with minimal, contemporary layouts and gentle colour schemes, I’d love to see a sample of your previous invitation or stationery work and discuss any creative ideas you have for this c...","['Adobe Illustrator', 'Adobe InDesign', 'Adobe Photoshop', 'Graphic Design', 'Illustrator', 'Invitation Design', 'Photoshop', 'Print Design']",$70,6 days left,15.0,https://www.freelancer.com/projects/graphic-design/christmas-new-year-poster-est,2025-12-14T14:05:20
Freelancer.com,Graphic Design,Service Offerings Capability Statement,"I need this turned into a professional capability statement that mirrors the colour scheme of my website: # ADELAIDE INDUSTRIAL MAINTENANCE ## CAPABILITY STATEMENT **Web:** **Location:** Adelaide, South Australia **Coverage:** Nationwide ----- ## COMPANY OVERVIEW Adelaide Industrial Maintenance delivers expert industrial maintenance, shutdown support, and mechanical services across Australia. Founded on 23 years of hands-on trade experience and a decade of senior management expertise, we understand industrial maintenance from both the workshop floor and the boardroom. We provide skilled fitters, electricians, and boilermakers who combine technical excellence with commercial awareness—delivering maintenance solutions that minimize downtime, enhance safety, and drive oper...","['Adobe Illustrator', 'Adobe InDesign', 'Adobe Photoshop', 'Branding', 'Business Writing', 'Content Writing', 'Copywriting', 'Editing', 'Graphic Design', 'Technical Writing']",$10,6 days left,5.0,https://www.freelancer.com/projects/adobe-illustrator/service-offerings-capability-statement,2025-12-14T14:05:20
Freelancer.com,Graphic Design,Premium Logo Design for Exam-prep SaaS,"Contest Title Premium, Calm Logo for | Exam-prep SaaS for California insurance licensing Brand / Project Overview is a subscription SaaS that helps California insurance candidates pass their licensing exams (primarily Property & Casualty, also Life/Health). The product provides a structured daily study plan, targeted practice, and clear progress tracking. We want a brand that feels premium and calm: confident, steady, and reassuring. More “quiet competence” than “hype.” What we need A primary logo plus variants that work across: • Website header (horizontal) • App icon / favicon (icon-only) • Social profile avatar (icon-only) • Light and dark backgrounds Brand personality • Calm confidence, clarity, trust • Modern, po...","['Adobe Illustrator', 'Branding', 'Graphic Design', 'Icon Design', 'Logo Design', 'Photoshop', 'Typography', 'Visual Design']",$30,6 days left,612.0,https://www.freelancer.com/contest/premium-logo-design-for-examprep-saas-2670082,2025-12-14T14:05:20
Freelancer.com,Graphic Design,Vibrant Social Media Graphics,"I’m refreshing my brand’s presence across Instagram, Facebook and Twitter and need a creative partner who can turn ideas into scroll-stopping visuals. The scope is purely social media graphics: feed posts, stories and banner/header images tailored to each platform’s size and best practices. Here’s what I have in mind: • Custom, on-brand concepts built in Adobe Photoshop or Illustrator (Figma or Canva is fine if the layers remain editable) • Web-ready exports in PNG/JPG plus the original layered source files • Two revision rounds so we can fine-tune colors, typography and layout I’ll supply logos, color palette, copy and a mood board on kickoff. You bring the design flair, consistency and quick turnaround. If you’ve produced coh...","['Adobe Illustrator', 'Adobe Photoshop', 'Canva', 'Graphic Design', 'Illustrator', 'Logo Design', 'Photoshop', 'Social Media Marketing']",$11,6 days left,12.0,https://www.freelancer.com/projects/adobe-photoshop/vibrant-social-media-graphics-40062911,2025-12-14T14:05:20
Freelancer.com,Graphic Design,CATERBOX Sleek Logo Design,"I need a modern, sleek logo that instantly positions CATERBOX as the professional choice for glassware and chinaware storage and transportation. The company manufactures sturdy boxes—often with internal dividers—for safely storing and transporting glassware, chinaware and cutlery, so the mark should feel engineered and reliable while still looking contemporary. The text for the logo must be 'typo round' font. Please include the words ' Pack & Protect - Stack & Store under the word Caterbox. The business name itself deserves first-glance prominence. You may present it as the single word “CATERBOX” or break it visually into “cater box” if that strengthens readability. Subtle graphic hints of a box outline, stacked dividers or prot...","['Adobe Illustrator', 'Adobe Photoshop', 'Branding', 'Graphic Design', 'Illustrator', 'Logo Design', 'Photoshop', 'Vector Design']",$26,6 days left,604.0,https://www.freelancer.com/contest/caterbox-sleek-logo-design-2670075,2025-12-14T14:05:20
Freelancer.com,Graphic Design,Bold Website Product Banner,"I need a fresh homepage banner that grabs attention right away and clearly promotes one of our key products. The look I’m after is bold and vibrant—think strong contrasts, energetic imagery, and typography that pops without feeling cluttered. I’ll supply the exact color palette so the design aligns perfectly with our established tones, but I’m open to your creative ideas on layout, graphics, and any subtle motion you think could elevate the piece. The finished artwork should be ready to drop straight into the existing hero slot on the site. Please deliver the master source file (Photoshop or layered PSD preferred) along with a web-optimized JPG/PNG at the final dimensions I’ll share once we start.","['Banner Design', 'Graphic Design', 'Photoshop']",$19,6 days left,15.0,https://www.freelancer.com/projects/banner-design/bold-website-product-banner,2025-12-14T14:05:20
Freelancer.com,Graphic Design,Japanese-Hybrid Landscape Concepts Needed,"No AI submissions will be accepted. I am currently midflight into our new estate build and I’m ready to start thinking about the landscaping plan. It's a four-acre new-build site—three acres of open, level ground plus a one-acre native gully with a goal to transform the property into a distinctive, Japanese-inspired haven with some alpine elements. What I need first is a set of initial concept designs I can compare side-by-side and refine further before we move into detailed plans. Here is the creative framework you’ll be working with: • Style direction I’m leaning toward a Japanese hybrid, the house design is influenced by an alpine stone build. I’m open to fresh angles as long as the overall feel remains calm, refined and connected to nature....","['3D Rendering', 'Concept Design', 'Design Thinking', 'Graphic Design', 'Landscape Design', 'Visual Design']",$294,6 days left,158.0,https://www.freelancer.com/contest/japanesehybrid-landscape-concepts-needed-2670071,2025-12-14T14:05:20
Freelancer.com,Graphic Design,Service Offerings Capability Statement,"I need this turned into a professional capability statement that mirrors the colour scheme of my website: # ADELAIDE INDUSTRIAL MAINTENANCE ## CAPABILITY STATEMENT **Web:** **Location:** Adelaide, South Australia **Coverage:** Nationwide ----- ## COMPANY OVERVIEW Adelaide Industrial Maintenance delivers expert industrial maintenance, shutdown support, and mechanical services across Australia. Founded on 23 years of hands-on trade experience and a decade of senior management expertise, we understand industrial maintenance from both the workshop floor and the boardroom. We provide skilled fitters, electricians, and boilermakers who combine technical excellence with commercial awareness—delivering maintenance solutions that minimize downtime, enhance safety, and drive oper...","['Adobe Illustrator', 'Adobe InDesign', 'Adobe Photoshop', 'Branding', 'Business Writing', 'Copywriting', 'Editing', 'Graphic Design', 'Technical Writing']",$151,6 days left,3.0,https://www.freelancer.com/projects/graphic-design/service-offerings-capability-statement-40062892,2025-12-14T14:05:20
Freelancer.com,Graphic Design,Service Offerings Capability Statement,"I need this turned into a professional capability statement that mirrors the colour scheme of my website: # ADELAIDE INDUSTRIAL MAINTENANCE ## CAPABILITY STATEMENT **Web:** **Location:** Adelaide, South Australia **Coverage:** Nationwide ----- ## COMPANY OVERVIEW Adelaide Industrial Maintenance delivers expert industrial maintenance, shutdown support, and mechanical services across Australia. Founded on 23 years of hands-on trade experience and a decade of senior management expertise, we understand industrial maintenance from both the workshop floor and the boardroom. We provide skilled fitters, electricians, and boilermakers who combine technical excellence with commercial awareness—delivering maintenance solutions that minimize downtime, enhance safety, and drive oper...","['Adobe Illustrator', 'Adobe InDesign', 'Adobe Photoshop', 'Branding', 'Business Writing', 'Content Writing', 'Copywriting', 'Editing', 'Graphic Design', 'Technical Writing']",$176,6 days left,3.0,https://www.freelancer.com/projects/graphic-design/service-offerings-capability-statement,2025-12-14T14:05:21
Freelancer.com,Graphic Design,Illustrated App Guide Images,"My Android app needs a short, eye-catching guide that new users can flip through before (and right after) installing. The plan is simple: five to six standalone images that I can upload as Play Store graphics and also drop into the in-app “Guide” screen. Content focus Only an overall features showcase is required—no deep dive, no FAQ, just a clear snapshot of what the app does and why it matters. Visual style Please rely on clean, illustrative graphics rather than plain screenshots. Think friendly flat art or minimal vector scenes, paired with brief captions that stay readable on mobile. I’ll share the colour palette, logo, and the short list of features; the illustration style is up to you as long as it feels cohesive with modern Android (Material 3) desi...","['Adobe Illustrator', 'Adobe Photoshop', 'Graphic Design', 'Illustration', 'Photoshop', 'User Interface / IA', 'Vector Design', 'Visual Design']",$2,6 days left,6.0,https://www.freelancer.com/projects/graphic-design/illustrated-app-guide-images,2025-12-14T14:05:21
Freelancer.com,Graphic Design,Print Product Catalogue Design,"I need a talented graphic designer to transform my product range into a visually engaging, high-quality print catalogue. The final piece will serve as a dedicated product showcase that buyers can flip through, so every spread should balance clean layout, compelling imagery and concise copy. You’ll take the raw assets I provide—photos, specs and existing brand guidelines—and develop an eye-catching concept, then build out the full catalogue to press-ready standards (CMYK, proper bleeds, embedded fonts). Along the way, please advise on paper size, page count and finishes so the design translates flawlessly from screen to print. Once the creative direction is approved, I’ll need: • Print-ready PDF with crop marks and bleeds • Native working files (InDe...","['Adobe Illustrator', 'Adobe InDesign', 'Adobe Photoshop', 'Catalog Design', 'Graphic Design', 'Illustrator', 'Print Design']",$66,6 days left,11.0,https://www.freelancer.com/projects/adobe-photoshop/print-product-catalogue-design,2025-12-14T14:05:21
Freelancer.com,Graphic Design,Bold Promotional Door Hanger Design,"I need a fresh door-hanger that works first as a promotional advertisement and also lets current customers know about an important service update we’re rolling out. The look has to be bold and colorful—think vibrant hues, strong typography, and graphics that pop when someone walks up to their front door. Content is ready on my end; what I’m missing is a striking two-sided layout that guides the reader’s eye from headline to call-to-action without feeling cramped. I’ll rely on you for smart use of space, balanced imagery versus copy, and print-ready preparation. Deliverables I’ll need from you: • Two-sided door-hanger design (CMYK, 300 dpi) • Print-ready PDF plus layered source file (AI or PSD) • A version optimized for quick social...","['Adobe Illustrator', 'Adobe Photoshop', 'Advertisement Design', 'Graphic Design', 'Illustrator', 'Photoshop', 'Photoshop Design', 'Print Design']",$7,6 days left,33.0,https://www.freelancer.com/contest/bold-promotional-door-hanger-design-2670062,2025-12-14T14:05:21
Freelancer.com,Graphic Design,Bold Instagram Campaign Graphics,"Two upcoming Instagram campaigns need eye-catching visuals that instantly communicate our brand story to middle-aged professionals and leave a memorable impression. The focus is pure brand awareness, so every post must be crafted to stop the scroll, spark recognition, and invite conversation—no hard selling. I already have short copy lines and a clear mood board. What I need from you is the full visual execution in a bold, vibrant style: colour palettes that pop, clean but energetic typography, and layouts optimised for both the main feed and stories. Consistency across the two campaigns is key, yet each should carry its own distinct twist so followers can tell them apart at a glance. You’ll receive brand guidelines, sample imagery, and campaign themes on kickoff. All source ...","['Adobe Illustrator', 'Adobe Photoshop', 'Canva', 'Figma', 'Graphic Design', 'Illustrator', 'Logo Design', 'Photoshop', 'Social Media Marketing', 'Visual Design']",$19,6 days left,69.0,https://www.freelancer.com/projects/adobe-photoshop/bold-instagram-campaign-graphics,2025-12-14T14:05:21
Freelancer.com,Graphic Design,Realistic Non-Fiction Book Cover Design,"I need a book cover design for a non-fiction book based on ten less usual long relationships - how they met, fell in love, developed, highs, lows and how they got through the years/decades. Thinking of a blank brick or stone or Mediterranean whitewash wall with rose/s growing up the side of book and strong typography. See attachment shows tone should be insightful/thought provoking and also, heartfelt, empathetic and sincere and grounded/credible. Approachable/engaging tone - broad audience. Balance of warmth of human emotion and authority/factual enquiry. 80,000 words approx. There are a lot of references woven into the couples' stories. The attached document outlines the book's title, subtitle and idea for the cover that seems to fit best after months of exploring ideas. Open ...","['Book Cover Design', 'Creative Design', 'Graphic Design', 'Illustration', 'Illustrator', 'Photography', 'Typography']",$166,6 days left,37.0,https://www.freelancer.com/projects/book-cover-design/realistic-non-fiction-book-cover-40062846,2025-12-14T14:05:21
Freelancer.com,Graphic Design,South Indian Yantra Design,"I want a traditional Yantra created for explicit religious use, incorporating both sacred geometry and authentic mantras or seed-syllables rendered in a South Indian regional language. The visual style must feel respectful, temple-ready and precise enough for ritual placement, yet elegant when enlarged for posters or engraved on metal. Any of the following scripts—Tamil, Telugu, or Kannada—are acceptable, so feel free to choose the one you are most fluent in or suggest which script best complements the geometry you plan to draw. What matters most is that every textual element is grammatically correct, spiritually appropriate, and beautifully integrated into the overall pattern rather than appearing as an after-thought. Deliverables • High-resolution vector file (AI or ...","['2D Drawing', '2D Layout', 'Animation', 'Graphic Design', 'Illustration', 'Illustrator', 'Logo Design', 'Vector Design']",$15,6 days left,10.0,https://www.freelancer.com/projects/illustration/south-indian-yantra-design,2025-12-14T14:05:21
Freelancer.com,Graphic Design,Attentive Designer for Fashion Brand Development,"Fashion Brand Design & Creative Support Needed We are a growing fashion brand looking for a skilled and creative designer to support our ongoing and upcoming projects. The ideal freelancer should have a strong sense of style, attention to detail, and experience working with fashion-related designs. Project Scope: Apparel design support (T-shirts, dresses, or seasonal collections) Creation of tech packs (measurements, fabric details, trims, stitching notes) Fashion graphics, prints, and pattern concepts Branding assets (logos, labels, tags, packaging) Social media creatives and lookbook layouts (if required) Requirements: Proven experience in fashion/apparel design Knowledge of fabrics, sizing, and garment construction Proficiency in Adobe Illustrator & Photoshop Ability to unde...","['Adobe Illustrator', 'Adobe Photoshop', 'Branding', 'Fashion Design', 'Graphic Design', 'Logo Design', 'Photoshop', 'T-Shirts', 'Textile Design']",$2,6 days left,9.0,https://www.freelancer.com/projects/fashion-design/attentive-designer-for-fashion-brand,2025-12-14T14:05:21
